{
  "protocol_version": "1.0",
  "task_id": "task_018f3a2b-7c8d-7e9f-8a0b-1c2d3e4f5a6b",
  "type": "create",
  "priority": "high",
  "status": "pending",
  "title": "AI助手推广文案",
  "description": "为Q2营销活动写一段200字左右的AI产品推广文案，风格活泼亲切，突出'智能'和'陪伴'两个卖点",
  "deliverable": {
    "format": "document",
    "target": "doc://产品文案库"
  },
  "assignee": "claude-alice",
  "creator": "ou_xxxxxxxxxxxxxxxx",
  "mentions": ["@alice"],
  "context": {
    "thread_id": "om_xxxxxxxxxxxxxxxx",
    "chat_id": "oc_xxxxxxxxxxxxxxxx",
    "reference_docs": ["doc_campaign_brief"],
    "previous_tasks": []
  },
  "deadline": "2025-06-02T18:00:00+08:00",
  "created_at": "2025-06-01T10:00:00+08:00",
  "updated_at": "2025-06-01T10:00:00+08:00",
  "orchestration": {
    "mode": "serial",
    "next_tasks": ["task_review_xxx"],
    "dependencies": [],
    "timeout_minutes": 120
  }
}
